ID;Titre;Prix;Nb. D'etudiant(e)s;Nb. d'evaluations;Evaluation;Niveaux d'experience2;Duree;Date et l'heure de publication 
1230950;The Fast Route to a Faster Financial Close;50;56;56;6.3;Tous;330;2017-06-23 18:05
533458;How to Obtain a Business Loan;20;1;1;7.6;Tous;960;2015-11-17 14:17
1250742;Complete GST Course For Small and Medium Enterprises;75;59;56;7.5;Intermediaire;150;2017-06-14 12:32
811534;The Visual Learning Basic Accounting Course;20;59;56;6.9;Tous;120;2016-05-03 17:14
1232382;Intro to Financial Statement Audits;50;60;56;6.7;Senior;180;2017-06-29 14:09
1233894;The Latest Updates 2016 Financial Accounting Standards Board;50;60;56;5.8;Junior;240;2017-06-29 17:40
1249164;Corporate Internal Controls and Fraud Controls;50;60;56;7.6;Junior;240;2017-06-29 13:27
46933;Business Accounts For Managers;30;33;30;6.2;Intermediaire;240;2013-04-23 09:07
282044;Introduction to the 8 Pillars for Accountants;20;33;30;7;Tous;38;2014-08-16 13:37
1240408;Forex Trading for Beginners Vol 1:A Forex Course Made Simple;175;62;56;6.9;Tous;90;2017-07-04 18:23
1165780;Ratio analysis for bankers and credit analysts;20;50;45;6.4;Tous;510;2017-04-12 12:55
1208148;Coaching Course:Investment Analysis for your clients;200;50;45;6;Tous;210;2017-06-23 12:35
1259396;Test your knowledge in Financial Management;30;20;18;7.6;Intermediaire;60;2017-06-21 01:05
1237912;Create Trading Robot Without Coding Skills!;145;63;56;6.7;Tous;660;2017-06-16 01:29
1276364;Bitcoin & Ethereum Course (2 Course Bundle);200;22;18;6.5;Tous;90;2017-07-05 15:06
1273896;Covered Calls - Powerful Income Strategy for Stock Traders;60;22;18;7.2;Tous;1530;2017-07-03 11:13
1156530;How to trade in the Forex market;200;59;45;7.1;Tous;120;2017-03-29 12:19
1264512;Trading Forex  - L'analyse des volumes;70;4;3;7;Junior;300;2017-06-29 17:32
1153854;Working Capital assessment for bankers, credit analysts;20;63;45;6.8;Tous;780;2017-04-06 19:30
1089610;3 Little Pigs: A Multiple Timeframe Forex Trading Strategy;20;33;22;7.3;Junior;870;2017-02-24 11:33
390510;Tax made simple for Limited Company Owners and Contractors;50;48;30;6.7;Junior;390;2015-02-18 06:50
101038;Bitesize Bookkeeping for busy people;20;33;20;6.8;Tous;90;2015-03-29 14:18
35409;Profits Turbo;20;33;20;8.4;Junior;690;2013-06-03 11:35
118836;FX Trading for Beginners;20;33;20;6.3;Tous;35;2013-11-30 23:10
591724;Financial Market Environment & Investment Strategies;105;50;30;7;Tous;390;2017-06-19 22:29
759262;Decide whether to Invest in a Business ;20;50;30;7.2;Junior;150;2016-02-15 12:33
782256;FMT: Forex Market Trader Certificate;20;50;30;5.9;Junior;240;2016-03-17 13:43
1069866;High-Frequency Trading & Dark Pools;40;19;11;7.6;Junior;90;2017-04-18 17:43
811416;Learn Financial Modeling from Scratch - Part1;50;7;4;7.5;Junior;270;2016-04-06 14:00
1223000;Innovators and innovation: Travel through time!;50;101;56;6.9;Tous;210;2017-05-25 13:41
1268616;Condor Broken Wing Butterfly Options Trading Course System;0;33;18;6.7;Junior;540;2017-07-06 15:47
1271684;Test your Knowledge in Banking Credit Analysis Process;30;33;18;6.9;Tous;210;2017-06-30 06:45
1163242;Profit and Loss Account for bankers and credit analysts;20;41;22;6;Tous;300;2017-04-23 18:07
614668;8 Steps To Achieve Financial Freedom And Escape Debt;40;59;30;6.9;Tous;210;2015-11-13 12:43
1221942;Basic Bookkeeping;35;112;56;7.6;Tous;540;2017-05-23 12:20
1232282;The Cash Flow Statement - An Introduction;50;112;56;8.1;Tous;1950;2017-06-28 12:05
1232312;Core Financial Statement Concepts;50;112;56;8.6;Tous;2250;2017-06-28 17:58
1232390;Corporate Ethics;100;112;56;6.4;Intermediaire;120;2017-07-03 17:39
1233302;Ratio Analysis for Financial Statements;50;112;56;6.2;Tous;1500;2017-07-03 17:39
1233314;Building a Balanced Scorecard;50;112;56;6.1;Tous;390;2017-07-03 17:38
1247992;Introduction to Project Management for Finance and Acct;50;112;56;7.4;Junior;120;2017-07-03 17:40
1249146;Planning and Executing a Financial Statement Audit;50;112;56;5.7;Tous;300;2017-06-29 19:18
1251582;Best Practices in Corporate Budgeting;50;112;56;7;Junior;90;2017-06-29 18:01
1057040;Teeter-Totter Accounting;90;90;45;6.4;Tous;330;2017-02-08 17:15
1136038;Free Ways to Create Passive Income Online;25;90;45;6.9;Junior;240;2017-04-17 18:33
1157298;Introduction to Forex Trading Business For Beginners;20;90;45;7.8;Junior;90;2017-04-23 12:19
1157298;Introduction to Forex Trading Business For Beginners;20;90;45;7.5;Tous;90;2017-04-23 12:19
1168172;Case studies on credit appraisal for bankers;20;90;45;6.2;Tous;90;2017-05-01 16:16
1169196;Credit concepts and checklist for bankers, credit analyst;20;90;45;6.2;Tous;300;2017-04-24 10:56
1187084;Forex how traders beat the markest with little experience;100;90;45;6.2;Junior;150;2017-07-06 17:16
1215926;Kickstarter success in 5 easy steps;20;90;45;8.8;Tous;60;2017-05-16 10:55
715476;The Cuckoo Strategy to get European Funding;160;60;30;6.7;Tous;34;2016-01-05 21:38
1032648;beginning accounting;20;60;30;7.1;Junior;600;2016-12-26 11:52
1035638;Understanding Financial Statements;25;44;22;6.3;Tous;90;2016-12-15 09:56
1035638;Understanding Financial Statements;25;44;22;5.8;Tous;60;2016-12-15 09:56
1058852;Learn to trade using technical analysis;50;44;22;6.9;Tous;33;2017-05-02 09:15
1064904;Evolution and Features of ETFs;100;44;22;8.1;Tous;38;2017-04-03 18:17
1083744;How to Invest Using ETFs from Former Wall Street Trader;200;44;22;8;Junior;600;2017-02-15 17:34
1084454;CFA Level 2- Quantitative Methods;40;44;22;6.9;Junior;180;2017-07-02 10:29
1084454;CFA Level 2- Quantitative Methods;40;44;22;7.8;Junior;90;2017-07-02 10:29
1087466;Stop Creditors from Harassing you and Avoid Bankruptcy;20;44;22;6.6;Junior;120;2017-02-02 11:22
1219820;Accounting - The 6 most important rules you must learn;20;40;20;6;Junior;60;2017-05-25 17:55
1231958;60 Minutes to Fundamental Accounting Skills;75;40;20;7.1;Intermediaire;720;2017-06-28 17:55
1251654;Understand Core Finance Principles in 60 Minutes;75;36;18;7.7;Tous;330;2017-06-29 18:04
1258666;Financial Statement Auditing Cycles;50;36;18;7.2;Junior;150;2017-06-29 19:20
1271182;Practical Film Financing: Finding & Pitching Investors;100;36;18;6.5;Tous;120;2017-07-05 17:46
1271430;Workshop on Banking Credit Analysis Process;100;36;18;7.3;Tous;44;2017-06-28 19:22
1276182;Options Trading Foundation: Your journey to competency...;95;36;18;6.6;Intermediaire;180;2017-07-05 00:41
1282064;Cryptocurrency (BTC & ETH) Investment & Trading Course 2017;20;36;18;6.9;Tous;930;2017-07-06 17:46
627332;Mutual Funds for Investors in Retirement Accounts;20;30;15;7.4;Tous;40;2015-12-17 00:38
837322;Essentials of money value: Get a financial Life !;20;30;15;7.5;Tous;36;2016-05-16 14:28
837322;Essentials of money value: Get a financial Life !;20;30;15;5.8;Junior;90;2016-05-16 14:28
885413;Foundations of Investing;40;30;15;7.5;Tous;150;2016-07-27 17:07
975910;How to achieve personal transformation;20;30;15;8;Tous;1350;2016-12-21 19:28
1110256;QuickBooks Online : Inventory Management For Non-Finance;35;8;4;6.8;Junior;810;2017-04-20 18:15
813360;Learn Financial Modeling from Scratch - Part 2;50;2;1;7.7;Junior;60;2016-04-07 11:15
861764;Geometry Of Chance strategy of defeating the roulette.;30;2;1;7.4;Junior;180;2016-06-28 13:51
1117834;Learn How To Trade Gold In 2017;200;2;1;7.6;Tous;1110;2017-04-06 00:59
1162656;Introduction to Bitcoin for Beginners;20;2;1;6.4;Tous;2670;2017-04-27 20:03
359926;UK Tax Returns with HMRC;40;63;30;7.5;Senior;210;2016-04-05 11:48
580068;Handle difficult questions the bank manager will ask you;20;63;30;7.6;Tous;390;2015-09-04 16:03
813516;Learn Financial Modeling from Scratch - Part 3;50;63;30;7.2;Tous;240;2016-04-07 10:59
513046;Learn The ABC's Of Investing And Understanding True Financial Value;20;63;30;8.6;Tous;90;2015-06-01 18:47
28172;Practical Trading on Financial Futures & Options Markets;50;43;20;4.5;Intermediaire;270;2012-11-12 10:01
1106148;Series 7: Intermediate Options;55;48;22;6.6;Tous;510;2017-04-17 18:33
849632;Write a Successful Business Grant Proposal;20;33;15;8;Intermediaire;990;2016-07-10 13:11
880564;The 7 fundamentals to Successful Cashflow Management;25;33;15;6.6;Junior;180;2016-07-11 13:22
889066;Trading Options Basics;200;33;15;4.7;Tous;120;2016-06-30 23:13
877968;Start-up financial modeling for non-finance professionals;20;33;15;7.8;Tous;1020;2016-06-20 17:49
914164;Forex Basics: Learn how to read and analyze Forex charts;195;33;15;7.3;Tous;390;2016-09-22 12:40
1141708;Managerial Accounting - The Ultimate Beginner Course!;100;33;15;7.1;Junior;60;2017-04-12 20:20
876898;Forex - Help I cant Trade;200;33;15;7.1;Junior;210;2016-10-18 14:51
944534;Forex:Trade Management & Psychology;150;33;15;5.5;Junior;60;2016-09-21 15:07
953432;Easy Finance For Startups;50;9;4;7;Intermediaire;210;2016-10-16 17:15
1082352;Trading Basics in 30 minutes;50;50;22;8;Tous;210;2017-02-26 16:59
1097288;Bookkeeping Practicals with Software;35;50;22;7.7;Tous;90;2017-02-06 19:16
1113702;Intro. to Asset-Backed Securities, CFA Level I,  2017 Prep;20;50;22;6.7;Tous;42;2017-03-27 15:59
597084;Don't Let Your Customers Run Your Business;50;7;3;6.1;Tous;660;2015-10-26 16:20
1073430;Xero Bookkeeping Course & Certification by Accounting Firm;20;7;3;7.3;Tous;540;2017-02-13 18:21
1257502;The Complete Litecoin Crypto Currency Bootcamp;20;7;3;6.9;Tous;41;2017-06-28 19:51
1029322;Accounting and Business Basics;200;48;20;7.8;Junior;120;2017-01-19 11:37
250902;Nest Egg Investing;45;48;20;7.8;Junior;60;2014-06-27 11:15
302484;A Practical Guide to Wealth Creation;35;48;20;6.6;Tous;120;2016-11-18 09:51
1031696;Introduction to Accounting - Analyzing Financial Statements;60;37;15;7.8;Tous;240;2016-12-13 16:12
589778;How to Read Financial Statements;20;5;2;5.6;Tous;38;2015-08-23 16:13
682986;Effective Debt Collection Strategies;40;5;2;6.9;Junior;300;2015-11-30 17:38
707224;Financial Statement Review 101:  How to Find Errors;30;5;2;7.9;Tous;750;2017-02-03 11:23
1078254;Tally ERP Complete Training in Urdu / Hindi;30;5;2;6.7;Intermediaire;510;2017-02-02 12:03
806122;Learn and Master the Basics of Finance;20;43;17;6.3;Tous;960;2016-09-25 16:37
1032234;Mastering the Market : (Technical Analysis + Candlestick);90;18;7;6.8;Junior;90;2016-12-16 10:01
1000136;Basics of Fixed Income Valuation, CFA Level I 2017 Prep;20;59;22;6.8;Junior;510;2017-01-28 11:47
1058530;How to Get Growing, Passive Income from the Fortune 500!;25;59;22;8.5;Tous;180;2017-01-19 11:07
364034;Finanzas y Análisis Financiero: Manejo Seguro de Negocios;20;50;18;6.9;Junior;90;2014-12-15 22:10
980408;Introduction to the economics of public services regulation;80;98;35;7.3;Senior;240;2017-01-03 12:57
996542;Mastering Countertrend Trading : High Profit Trading Pattern;40;14;5;6.5;Junior;300;2016-10-29 15:15
736836;The Investment Banking Recruitment Series;40;17;6;7.7;Intermediaire;60;2016-02-05 20:21
1010988;Economics for beginners - Various Concepts;25;63;22;7.5;Tous;180;2017-01-02 09:58
1056242;Practical Accounts Training A;35;63;22;8.1;Tous;42;2017-01-18 13:52
1072220;Reach Your Personal Financial Goals the Easy Way (2017 UK);95;63;22;6.5;Tous;38;2017-05-22 19:58
313512;Financial Reporting - Fundamentals/Basics;20;59;20;7.2;Tous;210;2014-11-07 21:53
304410;Credit Control Procedures;20;59;20;8;Tous;390;2014-09-21 23:58
309854;How to invest in Russian equity market;30;59;20;7.7;Junior;60;2015-09-15 14:28
1193288;Accounting Simplified;30;59;20;5.8;Tous;930;2017-05-03 12:14
773060;Forex: Economic News Trading;25;42;14;7.2;Junior;34;2016-02-29 13:44
93850;Financial Modeling - Facebook Case Study;25;9;3;7.2;Tous;510;2013-10-02 01:31
531710;Accounting and the Triple Bottom Line;30;6;2;6;Tous;1260;2015-07-09 20:16
560472;Trading Tips from Hedge Fund Manager;50;6;2;6.3;Junior;60;2015-07-22 16:56
1113822;Complete GST Course & Certification - Grow Your CA Practice;75;2792;923;7.4;Tous;240;2017-03-09 11:34
868112;Chief Wealth Officer;45;48;15;8;Tous;39;2016-06-03 18:38
904240;A Guide To Trade Binary Options Like An Expert;55;48;15;6.8;Intermediaire;270;2016-07-18 17:48
994118;Managing Budgets in the Public and Non Profit Sector;95;48;15;7.2;Tous;180;2017-06-22 16:28
607800;Introduction To The World Of Equity Finance;20;29;9;6;Junior;60;2015-12-08 12:12
690546;UK Self Assessment Tax Return Filing Online;20;23;7;7.6;Intermediaire;1530;2015-12-07 13:36
894336;Master The Psychology of Forex & Binary Options Trading;20;53;16;6.2;Junior;60;2016-07-04 14:47
1233350;Bitcoin Profits for Beginners;100;61;18;6.9;Tous;270;2017-06-09 13:01
73860;Financial Risk Manager (FRM) Certification: Level I;50;87;25;6.6;Tous;37;2013-10-26 08:54
671548;Accounting Basics 101 for Understanding Business;20;7;2;5.7;Junior;300;2016-01-07 12:48
700080;Budgeting for Business;40;78;22;8.6;Tous;41;2016-01-11 15:46
323916;Learn How To use Channels to find amazing Forex Entries;45;172;48;8.1;Junior;120;2017-05-24 14:05
828596;Global Macro Investing - Take Control Of The World's Markets;30;153;41;6.5;Intermediaire;300;2016-05-16 17:50
773502;Financial Accounting Part 2 - Passing The Class;20;15;4;6.9;Intermediaire;90;2017-05-01 18:58
302456;Bookkeeping Made Simple;40;61;16;8.1;Tous;780;2015-07-16 16:51
900472;How To Earn Some Bitcoin Every Time You Use A Search Engine;20;89;23;7.3;Junior;1230;2016-07-09 16:50
999262;Forex online live trading system (Special Offer);200;31;8;6.4;Junior;40;2016-11-07 09:51
855816;Investing in Stocks & Shares;20;59;15;5.7;Junior;90;2016-05-23 02:21
954842;Black Scholes Option Pricing Model;25;59;15;7.1;Tous;210;2017-05-03 12:42
562668;Financial Accounting Made Easy for All;20;87;22;8.2;Tous;60;2015-09-01 14:36
408232;CFA® Level 1 2014 – Quantitative Methods;50;119;30;7.2;Junior;540;2015-02-26 05:06
673750;How to invest in Forex Trading & add an additional income;50;8;2;8.2;Tous;60;2015-11-21 15:47
625670;Technical Charting;20;4;1;6.8;Junior;120;2015-11-02 15:23
1239206;Win 90% of Trades Quantitative Investments Models in Excel;200;4;1;6.2;Junior;180;2017-06-28 11:09
1246684;Dash Crypto Currency Technical and Trading Overview Bootcamp;20;4;1;6.7;Tous;180;2017-06-19 17:59
312834;Professional Trading With Institutional Supply & Demand;200;343;84;7.1;Tous;1320;2014-11-24 05:19
1225194;Zoho Books Gestion Financière d'Entreprise pas à pas;0;229;56;6.4;Tous;360;2017-05-26 12:45
689868;The Binary Institute -  Binary Options Trading Course;200;103;25;7;Tous;60;2015-12-14 13:27
1050168;Forex Trading : Power Of Moving Averages;200;100;24;8.5;Junior;90;2017-01-02 10:18
617976;Curso Completo del Mercado FOREX;200;359;86;7;Tous;120;2015-11-17 19:08
851288;Smart Trading Techniques for Safe & Consistent Weekly Result;100;46;11;7.2;Junior;60;2016-05-24 00:57
826912;Six Stage Negotiation;30;63;15;7.4;Tous;210;2016-05-11 13:08
754524;Fundraising Success: The Art & Science of Major Gifts;50;38;9;7.5;Junior;60;2016-05-27 13:16
538560;Stocks For Beginners - A Guide To Investing;20;64;15;6.1;Tous;450;2015-07-17 15:16
295909;Legal Accounting;110;26;6;5.4;Tous;3990;2014-09-21 00:58
722274;The Complete Investing Guide: How to Beat Wall Street;50;13;3;7.4;Junior;120;2016-06-14 15:11
1124276;Le bitcoin et la blockchain;80;13;3;7.2;Tous;60;2017-03-13 19:49
548044;Corporation Tax Returns UK;50;100;23;7.7;Junior;37;2015-07-23 15:21
323950;Use the Magic Multiple Moving Average Forex Trading system;50;1097;252;8.1;Junior;270;2014-11-07 21:21
1041522;Forex Trading :RSI Indicator-A Secret Weapon;95;57;13;6.7;Tous;39;2016-12-21 09:44
532216;Raising Capital for Your Business;50;22;5;6.4;Junior;390;2015-08-03 18:46
833770;Practical Financial Statement Analysis;75;22;5;5.8;Tous;300;2017-05-01 19:22
927442;Learn the Foundations of Stocks and Options;50;80;18;6.6;Intermediaire;210;2016-08-11 17:18
777276;Financial Accounting Part I - Passing the Class;20;45;10;7.3;Intermediaire;330;2016-06-29 10:53
907716;International Tax  - Tax Beyond boundaries;100;27;6;5.6;Junior;180;2016-09-06 11:03
516168;Budget preparation for an EU project proposal;50;18;4;6.4;Tous;150;2015-06-01 19:05
882276;Forex - Top Equity Management Strategy;20;18;4;7.6;Tous;35;2016-06-20 15:56
1036456;Basics of Private Equity;60;9;2;7.4;Tous;240;2017-05-09 18:19
1136912;Financial Accounting - The Ultimate Beginner Course;100;9;2;7.2;Junior;390;2017-04-05 20:39
75182;Trade Show Samurai;95;32;7;7.5;Junior;1110;2013-08-29 11:44
843854;The Complete Guide to Professional Trading with Elliott Wave;115;228;49;8.9;Tous;120;2016-05-11 12:40
702800;Forex: Presentation and  Analysis (Fundamental & Technical);50;14;3;7.5;Intermediaire;720;2016-01-15 21:52
850726;Forex trading with binary options;25;136;28;5.2;Junior;270;2016-05-16 17:40
302468;How to read a Profit & Loss Account and Balance Sheet;20;49;10;7.8;Tous;1050;2014-09-22 00:05
475912;Master The Stock Market with practice;35;49;10;5.5;Junior;150;2015-05-15 14:04
843536;Forex Trading Profit 183%p.a : Trend is Our Friend-ALGOTREND;120;54;11;7.3;Tous;210;2016-12-05 12:01
638966;188% Profit in 1Year - Forex ALGO Robot Trading no indicator;120;357;71;7.7;Junior;60;2016-05-03 15:04
1196728;From 0 to 1: Investments and Portfolio Theory;50;230;45;7;Junior;240;2017-05-01 19:42
521952;Ultimate Guide To Trading Engulfing Candlestick Strategy;200;185;36;6.6;Intermediaire;120;2016-10-24 22:14
619786;Profit During Crashing Markets: A Step-by-Step Guide;195;57;11;6.6;Intermediaire;480;2016-05-16 17:38
1151398;Trading Forex - Trader avec les figures harmoniques;90;57;11;6.6;Tous;90;2017-03-31 18:44
756520;Exam 1 Review - Managerial Accounting (U of H);30;47;9;7.1;Tous;120;2016-02-11 11:23
765238;Trading Algorítmico en Forex: Crea tu primer Robot de Forex!;170;206;39;7.3;Tous;60;2016-03-11 23:31
570996;Finance Fundamentals for Non Finance Leaders;20;37;7;6.9;Tous;120;2015-08-04 17:56
158444;Breakout Patterns Workshop by Pattern Trader;60;32;6;4.3;Junior;180;2016-09-09 00:22
685190;Crowdfunding for Filmmakers;65;32;6;5.8;Tous;60;2015-12-01 13:38
725872;Certificate in MYOB AccountRight Premier 2017 Course;200;97;18;7.2;Tous;210;2016-03-10 18:45
871358;Financial Modeling and Valuation: Complete Beginner to Pro;50;249;46;6;Tous;90;2016-06-20 18:09
65113;Professional Risk Manager (PRM) Certification: Level 4;50;38;7;5;Tous;34;2013-07-23 16:28
158830;Samuel and Co Trading - Stock & Forex Trading;50;592;109;6.7;Tous;90;2014-02-10 13:12
543242;Learn to Trade The News;200;1924;351;6.9;Intermediaire;840;2015-07-16 18:03
1046940;Trade RSI Breakout Strategy: Great Risk/Reward Ratio (Forex);200;66;12;7.2;Tous;36;2017-05-01 15:56
1153876;Term Loan Appraisal for bankers, credit analysts;20;11;2;7.3;Tous;480;2017-04-03 12:53
869652;Ethereum Course for Investors;40;111;20;7.3;Junior;150;2016-06-09 00:21
718338;How To Confidently Join The Bitcoin Revolution;45;547;98;7.2;Tous;270;2016-01-14 18:03
931626;Learn to Trade With Fibonacci Tools;30;252;45;8.6;Junior;120;2016-08-17 16:24
1209556;Hedge Fund Trading Systems Part Two - Stocks & ETFs;200;56;10;6.7;Tous;150;2017-05-16 18:22
328842;Learn to invest in the Stock Market;40;28;5;6.8;Tous;150;2014-11-12 12:37
696342;FOREX: From Zero To Hero;150;152;27;5.9;Tous;480;2017-02-07 00:21
1100054;FOREX TRADING - Learn in a quick + profitable way + support;100;271;48;7.3;Junior;120;2017-02-20 18:45
1107954;Day trading strategy for all level, with 72% success rate;95;51;9;6.8;Tous;240;2017-03-02 11:25
1113442;Beginners Chart Patterns Trading for Penny Stocks;200;40;7;5.9;Intermediaire;1110;2017-02-22 00:37
425338;Basics of Trading;40;99;17;7.2;Junior;60;2015-04-06 16:00
304426;Bank Reconciliation & VAT on Excel;20;30;5;4.7;Intermediaire;120;2014-09-22 00:56
441016;Filing with Companies House UK;30;30;5;8.3;Tous;630;2015-03-08 15:26
40039;Comprehensive Forex Mastery Program;45;650;107;7.3;Junior;240;2013-02-07 14:50
788756;Professional Forex Strategy+2 weeks for FREE trading alerts;95;55;9;7.8;Tous;60;2016-03-29 13:23
548764;ACCA FA1 Recording Financial Transactions;50;49;8;5.4;Tous;90;2015-07-14 19:01
796486;Super Fast Accounting - the fastest way to do your books;25;129;21;6.7;Junior;210;2016-03-18 13:32
380206;Stock Trading Essentials for Day Traders;100;94;15;7.6;Senior;330;2015-01-08 12:40
627540;Options Trading - How to Win with Weekly Options;115;7489;1190;6.5;Junior;150;2015-10-22 17:54
130366;Trading: High-ROI Trading;190;126;20;6.9;Tous;90;2014-02-05 14:02
167316;TRADER BOT: Introdução à Linguagem MQL5;20;209;33;8.5;Tous;450;2014-03-07 10:13
895030;Forex - Price action Reversal Strategy;20;38;6;6.9;Tous;150;2016-07-04 17:31
1101382;Binary Options Masterclass;200;70;11;7.3;Intermediaire;930;2017-02-13 11:37
702278;The Big Volatility Short: The Best Trade On Wall Street!;200;224;35;7.2;Tous;450;2016-04-25 12:25
667332;Robots de Forex: espere ganar 175%p.a! Incluye Robot de Fx! ;130;315;49;7.1;Tous;360;2016-01-22 13:47
593460;Successful Day Trading with Fibonacci;200;869;135;6.7;Tous;60;2015-08-31 15:54
308696;Forex MetaTrader 4: Master MT4 Like A Pro Forex Trader;150;2602;402;6.6;Tous;390;2015-10-28 13:32
986272;Hedge Fund Trading Systems For Stocks - Part One;200;52;8;7.3;Tous;60;2016-10-29 17:56
824034;Technical Analysis: Understanding Price Action;45;39;6;5.6;Junior;31;2016-08-26 18:57
1095700;Using Xero for your bookkeeping needs  do beautiful business;95;39;6;7.8;Junior;60;2017-02-27 11:33
530430;Fundraising 101;95;26;4;6.4;Intermediaire;120;2015-06-17 19:50
731150;How To Pay Less Tax (UK version);50;13;2;6.5;Tous;120;2016-01-19 13:20
818572;Financial Modelling in Excel Step by Step;20;13;2;9;Junior;90;2016-05-05 12:50
1013838;Price Action Gap Trading Strategies;20;13;2;6;Intermediaire;210;2016-12-30 21:59
964828;Forex Trading - Learn An Effective Forex Trading Strategy;95;223;34;7.1;Junior;60;2016-12-14 17:45
552058;Analyze Real Estate Investments | Financial Modeling;20;120;18;6.1;Junior;240;2015-07-21 17:45
640062;Accounting Made Easy: A Quick Guide to Financial Accounting;95;274;41;5.7;Intermediaire;90;2015-10-26 19:22
929526;Learn to trade Candlestick Patterns;20;155;23;6.6;Junior;540;2016-08-16 19:58
334838;Economics - CFA Level 1 - 2014;20;135;20;8.8;Junior;240;2014-11-08 08:48
537286;Learn the Basics of the Wave Principle:;30;27;4;6.4;Junior;120;2015-07-01 20:12
993160;Get Credit for Your EIN That's Not Linked to Your SSN;20;27;4;7.6;Tous;120;2016-12-14 12:29
24877;Introductory Financial Accounting;80;1793;265;5.9;Intermediaire;90;2012-10-02 23:20
509512;Forex For Beginners - A Guide To Currency Trading;20;68;10;6.6;Tous;630;2015-05-25 14:19
702138;Bitcoin Investing: The Complete Buy & Hold Strategy;25;477;70;7.7;Tous;600;2016-01-10 16:59
308690;Forex Trading A-Z™ - With LIVE Examples of Forex Trading;195;16900;2476;6;Junior;690;2014-12-12 18:58
317030;Learn how to double your Forex Trading Account in one trade;60;2900;424;5.6;Junior;35;2014-10-19 18:04
72644;Complete Claritas Investment Certificate;50;388;56;5.4;Senior;90;2013-08-05 12:01
765562;Comprehensive Guide to Financial Markets, Investing &Trading;60;4187;600;6.7;Tous;930;2016-02-29 13:45
407658;Read financial statements as a stock investor;20;56;8;5.9;Tous;270;2015-07-10 15:32
385604;Introduction to Financial Consolidation under IFRS;25;21;3;6.8;Tous;120;2016-12-05 09:18
721746;Forex Trading Plan;50;21;3;6.7;Tous;90;2016-02-13 00:53
429482;Fundraise the Simplified Way: A Crowdfunding Blueprint;35;7;1;6.2;Tous;180;2015-02-22 23:37
1027678;Depreciation, Amortization and Depletion;25;7;1;7.8;Junior;1530;2017-03-06 18:59
1179546;An Introduction to Financial Markets on Wall Street;30;7;1;6.9;Tous;1770;2017-04-27 20:08
881062;Options Basics & Trading With Small Capital! - Level 1;30;120;17;6.6;Junior;270;2016-07-26 16:26
929146;Learn Stock Options: Options Made Simple 101;35;93;13;6.6;Junior;60;2016-08-17 00:53
25794;How To Crowdfund;30;43;6;8.1;Tous;330;2012-10-02 18:00
831940;Fundamentals of Accounting for Business Owners;20;217;30;7.1;Tous;330;2017-02-06 11:35
572992;Investing: How to Fix Hidden Flaws Inside Your Portfolio;195;58;8;7.4;Tous;660;2015-12-02 21:30
1225564;Short Straddles - Exploit Earnings Option Volatility Crush;60;59;8;7;Junior;150;2017-05-24 10:45
1002282;Bitcoin - Ethereum: Trading -Watch me manage my own account!;165;431;58;6.3;Intermediaire;150;2016-11-11 23:22
1051430;Intermediate Accounting 1: Easy. Fast. Simple!;200;90;12;5.6;Junior;120;2016-12-29 12:21
859742;The Complete Ethereum Course: Get .01 Ether In Your Wallet;45;2507;333;6;Junior;420;2016-05-30 14:53
466558;Bonds For Beginners - A Guide To The Bond Markets;20;106;14;6.9;Tous;60;2015-04-20 17:17
607876;Mastering Candlestick Charting : High Probability Trading;50;123;16;6.5;Tous;180;2015-09-21 20:05
597716;Trade Pullback Candlestick Strategy - Make Consistent Pips;200;521;67;6.8;Tous;90;2016-02-24 12:30
177214;An Introduction to Management of Portfolios (MoP);20;117;15;6.9;Tous;1470;2014-03-06 04:12
808506;Candlestick Analysis For Professional Traders;95;913;117;6.7;Tous;720;2016-05-18 12:04
188418;Tape Reading: Learn how to read the tape for day trading;195;1013;128;7.7;Tous;60;2014-03-27 03:14
360916;Hot Trading Investing Strategy: ETF and Futures;50;80;10;6.5;Junior;120;2014-12-08 02:07
528104;Stock Trading Strategies: Profitable Trading in 7 Days.;50;80;10;7.2;Junior;240;2015-06-15 20:09
322118;IFRS Financial Reporting;55;72;9;6.8;Tous;1350;2014-10-24 12:55
304422;Flow Management and Forecasting;20;16;2;6.4;Junior;90;2014-09-22 00:57
244000;Forex Trading: The High ROI Forex Trading End of Day Course;125;8;1;6.5;Tous;390;2014-06-16 07:02
621014;System of Asset Management for Professionals (SAMP);50;8;1;8.2;Tous;60;2015-09-25 17:59
1178150;Double Your Salary With Free, Local, Job Training Courses;20;8;1;6.3;Intermediaire;270;2017-04-17 12:33
742106;Credit Risk Analysis;20;194;24;8.2;Tous;210;2016-01-28 17:09
