1148774;Options Trading 101: The Basics;100;1514;66;8.2;Junior;60;2017-03-23 18:19
257996;Bookkeeping made simple;30;23;1;8.8;Intermediaire;390;2015-02-13 07:50
564966;The Complete Chart Pattern Trading Course: A Proven Approach;200;2666;115;8.2;Tous;600;2015-08-10 17:07
767256;Mastering Technical Analysis : Maximizing Trading Profits;60;325;14;8.1;Tous;210;2016-03-04 10:33
193916;How to be A High Performance Insurance Broker Part 2;40;70;3;6.4;Tous;180;2014-04-06 12:50
38456;Essential Options: Strategies for Mastering the Stock Market;50;211;9;6.1;Tous;420;2013-03-06 00:28
255046;Investments and Financial Markets;40;71;3;4.9;Junior;60;2014-07-22 15:08
1022796;Trading for winning;200;168;7;6.9;Intermediaire;330;2017-01-23 00:18
774174;Bitcoin For Beginners: Your Quick Start Guide To Bitcoin;0;10670;444;7.3;Tous;240;2016-03-03 16:03
363404;Futures/Commodity Training (Basics);0;4863;202;7.7;Tous;840;2015-02-07 02:04
979616;Investing In Stocks For Big Gains, Fundamental Investing;200;267;11;6.8;Tous;120;2016-10-22 10:28
191854;Stock Market Foundations;0;19339;794;6.9;Junior;210;2014-03-31 17:35
1028030;Analysis of Company Financial Statements;20;832;34;7.3;Junior;90;2016-12-07 15:19
544176;Trading strategies with common sense technical analysis;75;1750;71;5.3;Junior;60;2015-07-19 13:41
262370;Accounting: Get Hired Without Work Experience;100;4661;187;8.3;Junior;120;2014-09-01 17:43
658766;Advanced Financial Management for CA / CS / CFA /CPA Exams;150;375;15;7.5;Tous;90;2015-11-03 13:22
95176;ChalkTalk: Financial Accounting;20;25;1;7.6;Tous;270;2014-01-23 17:33
615206;Professional Bookkeeping & Accounting 1: Sales & Purchases;35;551;22;8.5;Junior;120;2015-09-27 12:52
179824;Equity Products;50;426;17;7.2;Junior;120;2014-03-11 11:48
1016996;Introduction to Corporate Finance (Mergers & Acquisitions);0;2080;83;7.8;Tous;330;2017-02-28 11:14
936298;Trade the News in Forex: EA Robot Included;200;276;11;6.1;Junior;60;2016-08-29 22:40
467238;Advance Technical Analysis;50;152;6;7.7;Junior;660;2015-04-08 14:11
851106;Investment Crowdfunding 101 (a.k.a Equity Crowdfunding);0;4607;181;5.7;Tous;990;2016-05-16 20:43
425126;Year-end QuickBooks Procedures;20;51;2;7.6;Junior;60;2015-02-19 17:08
1225686;Learn Options on Futures for Hedging Options and Stocks;60;51;2;6.9;Tous;30;2017-05-23 18:23
529828;Python for Trading & Investing;95;638;25;7.3;Tous;210;2015-06-17 18:23
497236;Raise Your Credit Score to 800 Or More....;50;844;33;7.2;Tous;1350;2015-07-12 15:05
975414;Contango VXX - ETF Options Trading - Double Your Investment;200;513;20;7.6;Tous;120;2016-10-06 11:10
551910;SEASON 2 MQL4 Tutorial Bootcamp - Metatrader4 Trading Robots;25;462;18;7.1;Junior;240;2015-07-15 20:34
148028;Become a Career Day Trader: Asian-Pacific Futures Markets;20;207;8;6.6;Tous;2520;2014-01-27 16:44
868686;Double Entry Bookkeeping;50;440;17;6.7;Tous;1110;2016-06-15 14:23
19653;Accounting Skills for Managers;20;78;3;7.4;Junior;330;2012-06-27 12:41
317572;Accounting 1 Simplified for You;45;2490;95;6;Intermediaire;420;2014-11-09 22:28
352150;Learn to Trade for Profit: Ten Most Profitable Trading Rules;95;739;28;6.2;Junior;1140;2014-12-23 10:28
932274;The Ultimate Fibonacci Trading Plan for Forex and Stocks;200;399;15;6.1;Tous;630;2016-08-19 15:12
941120;Option Trading for Rookies: Make & Manage Profitable Trades;95;507;19;8.3;Tous;120;2016-09-02 18:19
42146;Advanced Finance and Accounting for Startups;40;188;7;6.9;Junior;38;2014-02-27 12:58
518886;MQL4 Tutorial Golden Goose;20;135;5;6.9;Tous;40;2015-06-07 15:32
673016;Build A Career In Forex Trading- Learn Fundamental Analysis;200;2092;77;5;Tous;420;2015-11-23 15:42
199450;Elite Trend Trader: Learn To Trade Stocks, Options & Forex;125;6451;237;5.5;Junior;120;2014-04-16 09:58
798740;Forex Traders - Create Your First Trading Robot. No Coding!;200;2295;84;6.8;Tous;240;2016-05-02 15:26
1188742;Introduction to Cryptocurrencies and Blockchain;0;3775;138;7;Junior;32;2017-05-01 17:18
671578;Forex SOS Course: Trading Tweaks And Working Forex Strategy;50;1315;48;6.7;Senior;60;2015-11-18 17:40
725658;FOREX : LearnTo Trade the Improved ( Advanced ) Patterns;75;55;2;8;Tous;3420;2016-01-12 22:15
265960;Fundamentals of Forex Trading;80;17160;620;5.6;Tous;300;2014-08-29 16:10
443584;Option selling trading as income source. Beginners friendly;195;1276;46;5;Tous;34;2015-04-06 13:34
233294;Financial Translation;20;167;6;8;Junior;60;2014-06-11 13:50
831066;Learn MQL5: Build an 8-Currency Hedging Robot (MetaTrader 5);150;2877;103;6.8;Tous;90;2016-04-26 18:41
709536;Learn to Trade Forex Naked Price Action Big Shadow Trade;0;5407;192;6.3;Tous;390;2016-01-24 23:08
1011058;How To Maximize Your Profits Trading Options;200;1276;45;7.5;Tous;720;2016-12-13 09:57
249950;Binary Options Course - Level 2;0;5874;207;6.7;Tous;31;2014-06-25 22:00
332848;Tax Strategy: Financial Planning for Beginners;200;1703;59;6.2;Tous;210;2014-11-03 20:37
773934;CryptoArbitrager: Bitcoin Trading Robot (no mining);150;1224;42;7;Tous;210;2016-03-23 17:13
885342;Financial Modeling 101;0;1086;37;6.3;Intermediaire;1140;2016-12-19 18:43
1006314;Financial Modeling for Business Analysts and Consultants;45;2174;74;7.2;Tous;270;2016-12-19 14:26
382824;Investment Banking Operations : Securities Trade Life Cycle;30;267;9;5.4;Junior;360;2015-01-02 05:18
920424;Option Trading for Rookies: Basic Option Strategies;95;810;27;7;Tous;90;2016-08-25 14:10
390472;How To Set Up A Limited Company In The UK;0;2075;69;7.3;Tous;360;2015-04-20 19:31
934614;Beginners Guide to Stock Market Investing;0;3283;109;6.4;Junior;360;2016-09-15 14:30
1090408;Learn How to Trade Binary Options Professionally;0;5144;169;6.7;Junior;120;2017-02-03 17:15
403602;Forex Killing Divergence - How to trade with precision;20;1168;38;7.7;Junior;90;2015-01-25 13:41
657130;Trading Mindset, and Three Steps To Profitable Trading;20;246;8;5.8;Tous;240;2015-11-02 15:13
923184;Pin Bars: The Most Powerful Forex Trading Signal;200;494;16;7;Tous;1020;2016-08-10 09:10
189160;Financial Analysis:  A Recipe for Success;0;19614;635;6.9;Tous;120;2014-04-23 11:10
363058;Technical Trading and Investing Made Easy;40;217;7;7.7;Tous;90;2014-12-24 17:46
986034;Technical Analysis Using Elliott Wave Theory;60;217;7;4.2;Intermediaire;90;2016-11-01 15:30
172898;Fundamental Financial Math;50;406;13;8;Junior;90;2014-03-04 14:36
97338;Forex Basics;0;22344;712;6.9;Tous;420;2013-10-16 13:40
1088102;The Psychology of Trading;20;95;3;4.3;Intermediaire;60;2017-02-01 22:58
498488;Your First Successful Forex Trades - With Case Studies;200;1079;34;5.4;Tous;150;2015-05-26 16:48
975074;ALGOTECH Hedge Fund Method for Stock Market Trading;20;605;19;7.6;Junior;32;2016-10-10 17:05
739910;Learn To Trade The Forex Naked Price Action Acapulco Trade;70;288;9;7;Tous;810;2016-01-25 13:11
828254;Budgeting Hacks to Build Wealth!;0;4931;154;6.4;Tous;420;2016-05-31 11:10
781954;Cost Accounting and Financial Management - A Complete Study;150;452;14;6.7;Tous;34;2016-03-04 12:04
302562;Introduction to Accounting: The Language of Business;20;11958;370;8.9;Tous;150;2014-10-02 05:16
706670;FOREX : Learn Technical Analysis;200;1199;37;7.2;Tous;330;2016-01-01 14:04
58977;Financial Statements Made Easy;95;8095;249;7.3;Intermediaire;120;2013-06-08 20:21
637922;Venture Capital. What is it and Why it Matters to You!;50;1566;48;7.8;Tous;240;2015-10-14 13:50
975046;Trading Options With Money Flow;200;1380;42;7.6;Tous;480;2016-10-18 18:52
270844;IAS 1-Presentation of Financial Statements ;0;2674;81;7.7;Junior;990;2014-10-03 08:31
304000;Financial Modelling for entrepreneurs;20;232;7;4.1;Tous;1080;2014-09-20 04:26
1034074;Introduction to Value Growth Investing;0;2768;83;5.8;Junior;120;2016-12-20 11:08
100526;Winning Options Trading System;105;367;11;7.8;Tous;60;2013-10-09 17:12
282050;The Day Trader: Learn to Trade The Stock Market and Forex;20;768;23;7.6;Tous;300;2014-08-21 13:18
1024862;Making Tax Digital - UK HMRC Legislation Explained;0;743;22;8;Intermediaire;180;2017-06-06 10:13
507486;Technical Analysis 101: Secrets of Trading Revealed;150;912;27;8;Tous;270;2015-07-16 18:29
530246;Learn To Invest In Index Funds and ETFs In 7 Easy Steps;20;1132;33;8.5;Tous;120;2015-07-20 19:48
612528;Corporate Finance and Alternative Investment for CFA L1;20;103;3;5.7;Tous;870;2015-09-17 14:09
414246;Bitcoin for Accountants;0;3519;102;6.6;Tous;240;2015-02-05 22:15
64173;Trading: How Transformative Learning Drives Expertise;30;69;2;7.8;Tous;210;2013-07-15 13:20
189996;Introduction to Digital Payments ;0;12217;351;6.5;Intermediaire;510;2014-04-29 01:49
936884;Free Options 101 - Basic of Call and Put Options in 1 Hours;0;2481;71;8;Junior;120;2016-08-22 14:10
889824;61% Profit In 1 Month - Crush Your Forex Trading Paradigm;20;1027;29;7.2;Junior;270;2016-07-18 18:38
402836;Accounting 101: How to read an Accounting Balance Sheet;200;3050;86;5.7;Junior;120;2015-01-27 04:27
247940;Monetizing Your Website: How to Add Cost-Per-Action (CPA) ;35;142;4;7.8;Tous;39;2014-06-30 13:05
407984;Financial Model Basics: Build a model from start to finish;30;5057;142;7.1;Tous;210;2015-02-06 02:12
584410;The Ultimate Guide to Dividend & Dividend Growth Investing;200;2115;59;7.1;Tous;240;2015-11-13 13:10
745832;Succeed at Options Even If You Don't Know Where to Start;200;36;1;8.1;Junior;330;2017-04-17 14:00
945750;Fundamentals of Accounting;20;1560;43;6.1;Junior;90;2016-08-31 18:03
723510;The Complete Position Trading Course: Position Trading Stock;45;1311;36;8.1;Junior;870;2016-01-15 13:10
1154754;Financial Modeling for Startups & Small Businesses;195;4991;137;6.5;Junior;210;2017-03-29 18:36
73898;CFA Level I Workshop 1: Ethics and Quantitative Methods;20;147;4;6.1;Junior;120;2013-08-12 09:21
519776;How to Build a Massive Stock Portfolio from Zero;200;1882;51;8.5;Tous;210;2015-07-20 19:07
601912;TRADING: 5K CHALLENGE;55;375;10;6.4;Tous;300;2015-09-11 20:13
1123226;MasterClass-Japanese &  Heiken Ashi CandleStick Patterns;195;375;10;7.4;Intermediaire;120;2017-03-12 12:13
805336;Introductory Forex Trading Course;0;5931;158;6.4;Tous;870;2016-05-04 18:34
602032;Ultimate Stock Market Investing: Learn How to Value Stocks;50;1519;40;8;Junior;60;2015-11-02 19:09
419308;TRADING TACTICS;145;951;25;6.9;Tous;330;2015-02-13 15:19
1191504;How to create a routine Trading;25;307;8;6.7;Junior;120;2017-05-01 14:50
862786;Financial modeling: Build a multiples valuation model;20;656;17;7.2;Tous;150;2016-05-30 14:00
542028;MQL4 Tutorial Bootcamp - Trading Robot Coding in Metatrader4;30;1278;33;5.8;Junior;60;2015-07-02 17:57
73046;CFA Level I Foundation Course: Introduction to Quants;50;155;4;6.7;Tous;540;2013-08-05 12:03
738910;[Value Investing] Where White People Keep Their Money;200;2715;70;6.2;Tous;60;2016-05-25 17:04
883394;Forex - Calculate Lot Size Like Pro;20;543;14;6.5;Tous;300;2016-06-20 23:14
860890;"Using 'The Greeks To Understand Options""";50;2134;55;7.8;Junior;540;2016-07-13 14:37
59725;Small Business and Managerial Accounting Training Tutorial;20;117;3;7.8;Intermediaire;450;2013-06-19 13:52
327962;Forex Trading Profitably;20;512;13;7.1;Tous;120;2014-11-04 07:37
474150;Technical Analysis tools for Stocks and Options trading;40;3555;89;9;Tous;900;2015-04-12 14:31
479496;Basic Technical Analysis;50;40;1;8.4;Tous;38;2015-08-05 13:19
737514;Forex Scam: Avoid the scam today;20;1086;27;8;Intermediaire;180;2016-02-04 19:04
915206;MetaTrader4 Platform Training;0;1819;45;6.4;Junior;120;2016-09-21 15:16
213154;Automate Your Finances;20;690;17;8.2;Junior;39;2014-05-08 19:09
511952;Investment Banking: How to Land a Job on Wall Street;75;1218;30;6.6;Junior;120;2015-06-11 15:09
830994;Non Directional Weekly Options Trading System - ETF & Emini;200;897;22;6.4;Tous;90;2016-05-24 11:43
65105;Professional Risk Manager (PRM) Certification: Level 2;50;41;1;6.7;Tous;90;2013-07-23 16:24
1266306;Forex Trading: Your Complete Guide to Get Started Like a Pro;140;1026;25;8;Junior;330;2017-06-27 18:21
255280;WE WILL PAY YOU TO TRADE WITH US;20;2101;51;7.5;Tous;180;2014-08-18 17:09
703770;MQL4 Programming for Traders: Build Robust Trading Robots!;195;1367;33;8;Tous;240;2016-02-21 19:31
722682;Advanced Excel functions;20;1964;47;6.7;Junior;150;2016-01-12 15:03
598094;Crowdfunding to Win;40;627;15;7.4;Tous;120;2015-09-23 18:16
953490;TopTrader Academy - Complete Options Course;150;42;1;7.5;Tous;90;2016-09-13 18:09
474238;Excel functions to analyze and visualize data;20;2283;54;6.7;Tous;120;2015-04-20 14:52
610890;TRADING PSYCHOLOGY: Trading Mindset Mastery;120;975;23;8.6;Tous;180;2015-09-30 14:57
226084;IAS37 - Provisions, Contingents Liabilities & Assets;0;2247;53;7.7;Junior;120;2014-06-30 04:58
514036;Crystal ball trading - foresee price with seasonal patterns;145;807;19;5.6;Intermediaire;360;2015-06-14 18:08
543212;Forex Trading using professional indicators by TOP traders;200;1699;40;7.8;Tous;360;2015-07-07 16:37
517938;Algorithmic Trading in MATLAB: WFAToolbox App GUI (Finance);20;1749;41;6.5;Tous;270;2015-06-23 18:37
403628;Bookkeeping to Command Senior Bookkeeping Wages;55;683;16;5.5;Tous;2580;2015-03-05 20:31
735550;How to Trade Binary Options Effectively – All Levels;195;1680;39;6.5;Tous;60;2016-01-27 12:51
215728;Shark Accounting - Building a Business by the Numbers!;20;6050;140;7.5;Tous;1050;2014-05-18 15:08
81064;Easy Forex and Futures Trading;100;218;5;7;Tous;210;2013-12-30 20:22
585752;Forex Trading Secrets |MT4 Robot (EA) inside, no coding;150;2096;48;6.5;Junior;60;2015-08-24 18:16
281844;How to Pick Stocks;20;131;3;7.6;Tous;60;2014-09-15 15:45
713416;Proven Methods In Trading Candlestick Patterns;75;438;10;7.6;Intermediaire;660;2016-02-12 18:44
462474;Business Banking 101;25;132;3;8.2;Tous;180;2015-04-06 14:05
316750;Technical Analysis 101: Master the Basics of Trading;95;2688;61;7.3;Intermediaire;810;2015-05-13 18:54
1053462;Management Accounting A Complete Study;150;133;3;6.1;Junior;90;2016-12-29 10:07
848664;Option Trading for Rookies:  Understand Options Completely;150;2893;65;6.9;Tous;450;2016-08-10 11:27
645634;How to Build Profitable FOREX Automated Trading Strategies!;200;358;8;6.8;Tous;180;2015-11-10 20:16
716828;The Beginner's Guide to the Futures and Options Trading;0;6185;138;6.8;Junior;120;2016-01-18 14:47
662996;The Tax Advantaged Investor: A Guide to Legal Tax Reduction!;0;1888;42;5;Tous;810;2015-12-17 00:22
1107904;Financial Reporting A Comprehensive Study;50;45;1;6.6;Tous;270;2017-02-09 16:58
923616;Website Investing 101 - Buying & Selling Online Businesses;0;6811;151;8.8;Tous;210;2016-08-05 13:03
73044;CFA Level I Foundation: Introduction to Financial Reporting;50;226;5;6.6;Tous;330;2013-08-05 12:02
153210;Learn Accounting. Understand Business.;200;5572;123;6.7;Tous;1200;2014-03-27 13:58
680044;Binary Options: Trading Strategies, 90% Accuracy and Signals;195;1723;38;4.9;Junior;270;2015-12-14 13:29
779000;Beginners Forex strategy;0;2144;47;7.9;Tous;150;2016-03-18 11:07
599684;Profitable binary option trading strategy;195;1096;24;5.4;Junior;120;2015-10-28 20:34
592338;Forex Trading Secrets of the Pros With Amazon's AWS;200;4284;93;6.8;Intermediaire;210;2015-09-11 12:47
515326;Financial analysis: Compare performance of companies;20;1850;40;8.8;Intermediaire;60;2015-06-01 16:09
74004;CFA Level I Workshop 4: Fixed Income and Equity;20;139;3;5.7;Tous;150;2013-08-12 09:51
536166;TRADING MARKET MAP;45;1489;32;6.7;Intermediaire;43;2015-07-01 12:25
521342;Succeed in Forex Even if You Don't Know Where to Start!;200;1806;38;7.1;Tous;240;2015-06-19 18:16
442114;Take Control By Learning The Stock Market Now;30;1440;30;6.8;Tous;60;2015-03-09 21:15
662318;Learn Quickbooks to maintain books properly;20;241;5;8.2;Junior;60;2015-11-09 15:36
1068986;How To Profit From Stock Market Volatility;0;1736;36;6.7;Junior;330;2017-01-23 13:23
624016;TRADING FOR A LIVING: Trading Full-Time Transition Guide;195;483;10;7.3;Intermediaire;330;2015-11-06 11:18
572744;Trend Traders Club: How To Find And Trade Fast Moving Trends;75;1513;31;7.3;Tous;120;2015-08-04 15:16
988804;7 Steps: Your Introduction to Trading;25;1076;22;5.2;Tous;120;2016-11-04 18:07
119276;Aprende a hacer paper trading (simulación) con Ninja Trader;25;148;3;8;Junior;120;2013-11-15 12:53
219306;Learn about it;20;1193;24;6.6;Tous;60;2014-06-05 18:40
532836;How to Build a Massive Retirement Plan from Scratch!;200;1498;30;7.7;Tous;90;2015-06-22 19:04
57415;Interpreting Financial Statements;20;1449;29;4.4;Tous;1290;2013-06-06 17:50
917172;Forex - Trade Gartley with Precision - Complete Strategy;20;50;1;6.7;Junior;210;2016-07-29 12:49
258894;How to Read a Balance Sheet;50;1055;21;6.2;Intermediaire;60;2014-07-11 07:40
615602;Valuation of Goodwill for CA / CFA / CMA Exams;20;1509;30;7;Tous;90;2015-09-23 13:16
400976;Bitcoin Trading 101;95;302;6;6.9;Junior;90;2015-01-29 03:03
1020760;Introduction to Accounting : Mastering Financial Statements;50;1916;38;7.6;Tous;420;2016-12-05 17:14
757450;Bulletproof Personal Finance: Expert Asset Allocation;45;1119;22;6.6;Tous;120;2016-02-09 23:57
831170;CurrencyFair - Avoid Bank Charges when converting currencies;0;1730;34;7.2;Tous;150;2016-05-05 10:38
247558;A Complete Guide to Becoming a Trader on the Forex Market;25;562;11;7.4;Junior;42;2014-06-28 01:52
529718;Forex - Elliott Wave Theory with Fibonacci. ;20;2769;54;6.4;Tous;660;2015-06-19 18:06
619296;CFA: Fast Track your career in Finance;20;1393;27;6.5;Tous;210;2015-09-29 16:12
677802;Adventure Capital: How to pay off debt ;20;2895;56;6.8;Tous;150;2015-11-23 16:19
706942;Forex Trading For Beginners ;0;9483;183;8;Tous;840;2016-01-13 21:46
466774;Learn About Bitcoin and Bitcoin Mining;20;520;10;6.6;Tous;60;2015-05-01 19:05
262818;Simple Options Trading System;35;104;2;7.6;Tous;1050;2014-07-31 16:25
1079040;Leaps Options Trading System - Diagonal Leaps Options Spread;200;993;19;7.8;Tous;600;2017-01-19 14:09
1134864;Simple things you must know before start FOREX (OFFER);200;1053;20;6.7;Tous;90;2017-03-10 17:11
493014;Financial modeling: Build a forward looking financial model;20;2317;44;7.5;Tous;43;2015-05-05 13:47
662450;How I Trade Forex Successfully;0;5768;109;8.8;Intermediaire;60;2015-11-13 12:28
136244;Triple P Trading Course;20;797;15;7.6;Tous;1500;2013-12-23 23:53
674354;Invest Like a Pro!;200;1173;22;6.5;Intermediaire;390;2015-12-29 13:56
1266148;Preparation of Consolidated Financial Statements (Basic);0;965;18;4.9;Junior;60;2017-06-28 16:37
501960;Binary, Forex, Stock and Bitcoin Trading Strategy;0;3757;70;6.3;Tous;450;2015-05-28 18:38
557208;Accounting - Basic Costing ;40;108;2;7.7;Tous;540;2015-08-04 14:45
941520;Financial Accounting For Beginners;60;164;3;6.6;Junior;240;2016-09-25 14:41
987682;Stocks: Quick Method to get started Investing;0;718;13;7.8;Tous;120;2017-05-18 13:37
530768;Advanced Stock Options for Serious Equity Investors!;200;1271;23;6.1;Junior;240;2015-09-22 15:48
1170894;Python Algo Stock Trading: Automate Your Trading!;95;1165;21;6.6;Tous;630;2017-05-28 19:41
1218552;Forex for Beginners: Easy Forex Trading for Beginners;0;1780;32;6.3;Tous;90;2017-05-18 12:48
1103272;How to remove Risk from Penny Stocks - Options Trading;200;668;12;6.7;Tous;300;2017-02-06 19:45
1209694;Become A Forex Trader - Forex trading like a professional;0;1735;31;8;Junior;30;2017-05-28 10:35
389834;Stock Trading: Ultimate Guide to swing trading stocks;200;336;6;8.2;Tous;180;2016-10-25 12:11
401784;Options Trading Introduction: Day Trade Stock Options;95;12394;218;7.2;Junior;150;2015-02-20 16:39
312860;IAS 16-Property,Plant and Equipment ;0;2166;38;7.7;Tous;150;2014-10-06 05:11
614472;The Advanced Forex Course for Smart Traders;0;8236;144;6.5;Junior;150;2015-10-09 12:46
838260;Forex trading Basic to advance Professional Level course;20;750;13;7.9;Tous;450;2016-05-05 15:34
575676;Fundamentals of Investing!;20;3125;54;7.3;Tous;540;2015-08-09 14:34
830870;Forex Trading For Beginners: Technical Trading;0;1685;29;7.2;Tous;330;2016-04-28 18:42
471588;Learn how to INVEST for huge profits or make it big trading!;50;701;12;8.7;Tous;1110;2015-06-19 18:49
414744;Learn How to File Taxes for Uber and Lyft Drivers;40;294;5;7;Tous;990;2015-02-12 01:17
403468;Financial Accounting: The Complete Introductory Crash Course;100;2591;44;6.8;Tous;180;2015-01-26 15:09
1167710;The Only Investment Strategy You Need For Your Retirement;200;827;14;7.2;Tous;240;2017-04-18 14:13
771276;Introduction to Financial Statement Analysis;20;1480;25;7.2;Junior;120;2016-03-21 13:00
475032;Collection of Advanced Options concepts for Options traders;40;2025;34;6.8;Tous;180;2015-04-13 19:02
596026;Trade for Profit: Find-Trade Stocks Successfully Arabic;95;299;5;8.9;Tous;270;2015-11-11 19:51
285638;Learn to Trade for Profit:Trading with Japanese Candlesticks;60;16385;273;7.7;Junior;300;2014-09-01 23:53
915964;Learn to Reliably Invest In The Stock Market;50;841;14;8.7;Intermediaire;120;2016-07-29 11:06
323196;Master Finance in Three Hours;20;721;12;7.3;Tous;1230;2014-10-28 16:48
494330;Bookkeeping Made Easy;70;1263;21;7.7;Tous;90;2015-07-13 20:00
797762;Corporate Finance 101: Financial Statement Analysis & Ratios;50;967;16;6.3;Junior;90;2016-03-20 17:39
476256;Stock Options Trades Using Interactive Brokers;95;1580;26;7.6;Junior;90;2015-09-07 16:21
411778;Basics of investing in Mutual Funds;20;1589;26;6.3;Junior;300;2015-03-02 20:22
191588;IAS 10 - Events After Reporting Date;0;2146;35;6.5;Tous;390;2014-05-07 08:48
245822;Day Trading Market Structure Signals;0;5529;90;5;Tous;240;2014-06-18 12:42
761808;Learn About Trading Options from a real wallstreet trader;20;1046;17;6.7;Tous;120;2016-02-21 17:40
280842;Take Your Career to the Next Level with MBA Finance;50;618;10;6.8;Tous;60;2015-10-29 19:18
410576;CFA® Level 1 2014 – Portfolio Management;40;124;2;6.3;Junior;90;2015-03-01 20:46
478598;Forex Prep Academy for Beginners-Real trades!;75;1303;21;6.6;Intermediaire;420;2015-06-19 11:22
719698;Basic Technical Analysis: Learn the structure of the market;20;4919;79;7.8;Tous;120;2016-01-08 12:21
207166;How to Copy the Best Traders on Etoro;90;564;9;7.4;Junior;90;2014-05-01 16:37
354324;Accounting 2 Simplified for You;45;1446;23;7.6;Tous;120;2014-12-09 03:31
73938;CFA Level I Workshop 2: Financial Reporting & Analysis I ;20;126;2;5.8;Tous;540;2013-08-12 09:26
1095116;Penny Stocks King: How 2 really Trade Penny Stocks (6 Hours);200;1085;17;6.5;Junior;960;2017-02-03 11:44
73068;Introduction to the CFA Program;0;4248;66;8.3;Tous;420;2013-08-12 07:10
884658;Investing in Stocks? Master The Art of Covered Calls Selling;80;1095;17;7.4;Tous;60;2016-07-27 20:32
109988;Understand Banks & Financial Markets ;30;1548;24;6.1;Tous;180;2013-12-19 16:19
319020;Investing: How I Consistently Beat The Stock Market;200;2000;31;6.7;Junior;120;2014-12-11 15:35
876646;Direction-Independ Trading - Elite Forex Traders  Strategy;120;973;15;6.6;Junior;90;2016-06-21 18:46
637430;Learn the basics of preparing accounting statements;20;1951;30;5.2;Tous;660;2015-10-13 17:07
658764;Forex Management - Detailed Study for CA / CS / CFA Exams;50;131;2;7.5;Tous;210;2015-11-03 13:54
218416;Trading Binary Options for Fun and Profit;20;1574;24;6.1;Junior;36;2015-02-20 19:36
594936;Algorithmic futures trading - Investing with no experience;195;1512;23;7.3;Tous;90;2015-09-14 14:24
936328;Learn to Trade Forex and Stocks: From Beginner to Advanced;200;1645;25;6.5;Junior;150;2016-09-07 16:33
1175694;Get a Credit Repair Publication On Amazon and Live LIFE..;20;727;11;6.9;Junior;60;2017-04-26 14:17
443502;Essential Finance For Managers;25;663;10;6.1;Tous;330;2015-04-16 16:10
474928;Intermediate Options trading concepts for Stocks and Options;40;2000;30;6.4;Tous;150;2015-04-13 16:28
828740;Hedge Fund Accounting and Valuation;20;668;10;7.8;Tous;150;2016-04-28 12:39
434774;Options Trading Stocks: Proven Toolbox For Financial Success;195;7884;118;7.6;Tous;150;2015-05-19 19:25
192870;Trading Penny Stocks: A Guide for All Levels In 2017;150;9221;138;7;Junior;1320;2014-05-02 11:13
202290;Stock Market Mastery;20;135;2;6.2;Junior;180;2014-06-08 10:46
591880;1 - Concepts of Statistics For Beginners Step by Step;200;273;4;6.5;Tous;720;2015-08-30 18:48
835212;The Fundamentals Of Finance For Non-Finance Professionals;40;206;3;7;Tous;600;2016-05-18 12:02
965306;Forex: What's a Trend and When it is Strong and Reliable;0;2955;43;7.7;Tous;60;2016-10-05 11:39
49798;Bitcoin or How I Learned to Stop Worrying and Love Crypto;0;65576;936;7.5;Junior;150;2013-04-19 22:25
529424;How to Become a Financial Analyst from Scratch!;40;2177;31;7.7;Junior;60;2015-07-07 14:59
1062092;Emini ES Futures - Advanced Non Directional Options Trading;200;1057;15;5.6;Intermediaire;60;2017-01-11 15:48
253810;IAS 8-Accounting Policies ,Changes in Accounting Estimates;0;2122;30;6.7;Tous;420;2014-10-03 08:29
73962;CFA Level I Workshop 3: Financial Reporting & Analysis II;20;71;1;6.1;Intermediaire;33;2013-08-12 09:31
74028;CFA Level I Workshop 6: Alternatives, PM and Economics ;20;71;1;7.7;Tous;33;2013-08-12 10:20
199822;IAS 12 - Accounting for Income Taxes (Basics);0;4269;60;4.1;Junior;210;2014-05-17 09:19
707644;An Intro into Trading the Financial Markets;100;1006;14;6.8;Junior;120;2016-09-02 23:46
799434;Economics:   Competition, Elasticity, a little Game Theory;50;1008;14;6.1;Tous;180;2016-04-12 11:12
910650;Forex Trading: Comprehensive & Concise Forex Trading Course;160;2379;33;6.6;Intermediaire;90;2016-08-05 20:52
724062;Financial Statements Basics;20;1374;19;6.4;Junior;180;2016-01-14 13:58
546656;How to Trade Commodity and Financial Futures for a Living!;200;1240;17;7.1;Junior;210;2016-01-15 18:53
796450;How to Create Your Personal Budget;20;3870;53;6.8;Tous;420;2016-03-21 17:09
41973;Silver, Gold, and Inflation;0;5597;76;7;Tous;1230;2013-02-16 11:08
43778;Buying, Selling, and Storing Precious Metal;20;74;1;8.9;Intermediaire;360;2013-02-26 22:38
